{
  "$schema": "./scoped-package-name-review.schema.json",
  "schemaVersion": 2,
  "review": {
    "status": "PENDING_HUMAN_REVIEW",
    "reviewedOn": null,
    "reviewer": null,
    "authority": null,
    "factsSha256": "03009e395daed0104b4013108e951b0037aacf24c3acec98d81045eb403bf1cb",
    "digestAlgorithm": "sha256-sorted-json-v1"
  },
  "identity": "@hadden-industries/owlapi",
  "purpose": "A native-ESM JavaScript package for loading OWL 2 ontologies into a structural object model with deliberately registered compatibility to selected Java OWLAPI concepts.",
  "compatibilityWording": "The package may describe compatibility with Java OWLAPI concepts and registered Java mappings, but it must identify itself as an independently maintained JavaScript implementation and must not imply official status, sponsorship, endorsement, or organizational continuity.",
  "knownPriorUse": "This organization-scoped coordinate is separate from the blocked bare owlapi name and its unrelated Overwatch package history. The owner's authenticated scope inspection is recorded in ADR 0009; current publication permissions and exact coordinate availability require live preflight before publication.",
  "evidence": [
    "docs/adr/0009-scoped-npm-publication-and-uo-rc-acceptance.md",
    "docs/plans/scoped-npm-publication.md",
    "docs/provenance/package-name-review.json",
    "README.md",
    "package.json",
    "docs/compatibility/java-api-surface.json"
  ],
  "risks": [
    "The owlapi designation may still be mistaken for an official Java OWLAPI edition.",
    "An npm alias may obscure the actual registry identity unless manifests, locks and release evidence retain the scoped coordinate.",
    "Scope ownership and an absent coordinate do not by themselves prove permission to publish the reviewed artifact."
  ],
  "mitigations": [
    "Retain explicit independent-implementation and non-affiliation wording.",
    "Use only the scoped identity, retain explicit candidate/publication distinctions and exact consumer pins, and select version/channel effects through the separate exact-artifact release approval. Published rc.2 already owns next and latest; candidate selection grants no channel-write authority.",
    "Verify both direct scoped and native-alias installations against the actual package, registry integrity and provenance.",
    "Recheck organization permissions and exact coordinate availability immediately before the separately approved publication."
  ],
  "publicWording": "This project is an independently maintained JavaScript implementation. It is not affiliated with, sponsored by, or endorsed by the Java OWLAPI project. The selected scoped package is separate from the unrelated historical unscoped Overwatch package and has no code, API, ownership, or provenance relationship with it.",
  "externalLegalAdviceObtained": false,
  "decision": {
    "outcome": "PENDING_HUMAN_REVIEW",
    "rationale": "Maksym Shostak approved the scoped identity, non-affiliation wording and recorded mitigations on 2026-10-03 as part of his explicit authorization for all manual npm publication controls. This is a fresh scoped review and does not reuse the historical unscoped attestation.",
    "conditions": [
      "Complete the fresh scoped-name review and remaining exact-fact release reviews before publication.",
      "Keep publication disabled until the fully qualified artifact and supported publication mode receive the existing exact-artifact approval.",
      "UO and WebVOWL each accept the exact RC independently before production; stable 0.1.0 is not required.",
      "Any future migration to the bare owlapi name is a separate implementation."
    ]
  }
}
